{
  "$schema": "http://json-schema.org/draft-07/schema#",
  "type": "object",
  "properties": {
    "$schema": {
      "type": "string"
    },
    "id": {
      "type": "string"
    },
    "title": {
      "type": "string"
    },
    "tables": {
      "type": "array",
      "items": {
        "type": "object",
        "properties": {
          "name": {
            "type": "string"
          },
          "columns": {
            "type": "array",
            "items": {
              "type": "string"
            }
          }
        },
        "required": [
          "name",
          "columns"
        ],
        "additionalProperties": false
      }
    },
    "setupSql": {
      "anyOf": [
        {
          "type": "string"
        },
        {
          "type": "array",
          "items": {
            "type": "string"
          }
        }
      ]
    }
  },
  "required": [
    "id",
    "title",
    "tables",
    "setupSql"
  ],
  "additionalProperties": false
}
