{
  "$schema": "../dataset.schema.json",
  "id": "ecommerce",
  "title": "E-commerce orders",
  "tables": [
    {
      "name": "customers",
      "columns": [
        "customer_id",
        "name",
        "country"
      ]
    },
    {
      "name": "orders",
      "columns": [
        "order_id",
        "customer_id",
        "amount",
        "status",
        "created_at"
      ]
    },
    {
      "name": "products",
      "columns": [
        "product_id",
        "name",
        "category",
        "price"
      ]
    },
    {
      "name": "order_items",
      "columns": [
        "order_id",
        "product_id",
        "quantity"
      ]
    }
  ],
  "setupSql": [
    "CREATE OR REPLACE TABLE customers (",
    "  customer_id INTEGER,",
    "  name        VARCHAR,",
    "  country     VARCHAR",
    ");",
    "INSERT INTO customers VALUES",
    "  (1, 'Ava',  'UK'),",
    "  (2, 'Ben',  'US'),",
    "  (3, 'Chen', 'SG'),",
    "  (4, 'Dana', 'US'),",
    "  (5, 'Eve',  'UK');",
    "INSERT INTO customers",
    "  SELECT 5 + i, 'Customer ' || (5 + i), (['UK','US','SG','DE','FR'])[(i % 5) + 1]",
    "  FROM generate_series(1, 35) AS t(i);",
    "-- Two customers with NO orders at all (for LEFT/FULL join + anti-join demos).",
    "INSERT INTO customers VALUES (41, 'Finn', 'UK'), (42, 'Gwen', 'US');",
    "",
    "CREATE OR REPLACE TABLE orders (",
    "  order_id    INTEGER,",
    "  customer_id INTEGER,",
    "  amount      DECIMAL(10,2),",
    "  status      VARCHAR,",
    "  created_at  TIMESTAMP",
    ");",
    "INSERT INTO orders VALUES",
    "  (101, 1, 50.00, 'completed', TIMESTAMP '2026-01-02 10:00:00'),",
    "  (102, 1, 30.00, 'completed', TIMESTAMP '2026-01-05 12:00:00'),",
    "  (103, 2, 99.99, 'completed', TIMESTAMP '2026-01-03 09:30:00'),",
    "  (104, 2, 20.00, 'cancelled', TIMESTAMP '2026-01-04 09:30:00'),",
    "  (105, 3, 10.00, 'completed', TIMESTAMP '2026-01-06 14:00:00'),",
    "  (106, 1,  5.00, 'refunded',  TIMESTAMP '2026-01-07 14:00:00'),",
    "  (107, 4, 15.00, 'cancelled', TIMESTAMP '2026-01-08 11:00:00'),",
    "  (108, 5, 45.00, 'completed', TIMESTAMP '2026-01-09 09:00:00'),",
    "  (109, 5, 35.00, 'completed', TIMESTAMP '2026-01-10 16:00:00');",
    "-- Bulk: customers 6–40 only, so the specials' properties are untouched.",
    "INSERT INTO orders",
    "  SELECT 1000 + i,",
    "         6 + (i % 35),",
    "         ROUND(((i * 37 % 200) + 5) + (i % 100) / 100.0, 2),",
    "         -- status keyed on i//5 so it's independent of country (i%5-driven)",
    "         (['completed','completed','completed','cancelled','refunded'])[((i // 5) % 5) + 1],",
    "         TIMESTAMP '2026-01-01 00:00:00' + (i % 90) * INTERVAL 1 DAY + (i % 24) * INTERVAL 1 HOUR",
    "  FROM generate_series(1, 1000) AS t(i);",
    "",
    "CREATE OR REPLACE TABLE products (",
    "  product_id INTEGER,",
    "  name       VARCHAR,",
    "  category   VARCHAR,",
    "  price      DECIMAL(10,2)",
    ");",
    "INSERT INTO products VALUES",
    "  (1, 'Widget',    'Hardware', 9.99),",
    "  (2, 'Gadget',    'Hardware', 19.99),",
    "  (3, 'Doohickey', 'Hardware', 4.50),",
    "  (4, 'E-book',    'Digital',  12.00),",
    "  (5, 'Course',    'Digital',  49.00);",
    "INSERT INTO products",
    "  SELECT 5 + i, 'Product ' || (5 + i), (['Hardware','Digital','Software'])[(i % 3) + 1],",
    "         ROUND(((i * 11 % 90) + 5) + 0.99, 2)",
    "  FROM generate_series(1, 7) AS t(i);",
    "-- Three products never ordered (no order_items reference id > 12) for join NULLs.",
    "INSERT INTO products VALUES",
    "  (13, 'Prototype', 'Hardware', 199.00),",
    "  (14, 'Sticker',   'Merch',    2.00),",
    "  (15, 'Poster',    'Merch',    8.00);",
    "",
    "CREATE OR REPLACE TABLE order_items (",
    "  order_id   INTEGER,",
    "  product_id INTEGER,",
    "  quantity   INTEGER",
    ");",
    "INSERT INTO order_items VALUES",
    "  (101, 1, 2),",
    "  (101, 3, 1),",
    "  (102, 2, 1),",
    "  (103, 5, 1),",
    "  (103, 4, 2),",
    "  (105, 1, 1),",
    "  (106, 4, 1);",
    "-- Bulk line items: 1–2 per generated order.",
    "INSERT INTO order_items",
    "  SELECT 1000 + i, 1 + (i * 7 % 12), 1 + (i % 3) FROM generate_series(1, 1000) AS t(i)",
    "  UNION ALL",
    "  SELECT 1000 + i, 1 + (i * 13 % 12), 1 + ((i + 1) % 3) FROM generate_series(1, 1000) AS t(i) WHERE i % 2 = 0;"
  ]
}
